jid,id,groups,title,description,audit,remediation,references
7.1,7.1,Docker Swarm 配置,请确保不要在非必要情况下启用Swarm模式，以确保系统安全（Scored）,除非必要，不要在Docker引擎实例上启用Swarm模式。,查看docker info命令的输出。如果输出包括Swarm:active，则表明docker引擎上的Swarm模式已被激活。确认docker引擎实例上是否确实需要Swarm模式。,如果系统错误地启用了 Swarm 模式，请执行  docker swarm leave 命令退出。,https://docs.docker.com/engine/reference/commandline/swarm_init/
7.2,7.2,Docker Swarm 配置,确保在Swarm中创建了最少数量的管理节点（Scored）,确保在Swarm中创建了最少数量所需的管理节点。,运行docker info并验证管理器的数量。`docker info --format '{{ .Swarm.Managers }}' '。或者运行以下命令。`docker node ls | grep 'Leader',如果配置了过多的管理者，可以使用以下命令将多余的管理者降级为工作节点: docker node demote <ID>，其中<ID>是需要降级的管理者的节点ID。,"https://docs.docker.com/engine/swarm/manage-nodes/,https://docs.docker.com/engine/swarm/admin_guide/#/add-manager-nodes-for-fault-tolerance"
7.3,7.3,Docker Swarm 配置,确保Swarm服务绑定到特定的主机接口（Scored）,默认情况下，Docker Swarm服务将监听主机上的所有接口，对于主机具有多个网络接口并不一定必要。,列出端口2377TCP上的网络侦听器（docker swarm的默认值），并确认它只在特定接口上侦听。例如，使用ubuntu可以通过以下命令完成：`netstat -lt | grep -i 2377`,“修复这个问题需要重新初始化 swarm，指定特定的接口给 --listen-addr 参数。”,"https://docs.docker.com/engine/reference/commandline/swarm_init/#--listen-addr,https://docs.docker.com/engine/swarm/admin_guide/#recover-from-disaster"
7.4,7.4,Docker Swarm 配置,确保容器间在叠加网络的不同节点上进行数据交换时进行加密（Scored）,在覆盖网络上不同节点之间的容器之间加密交换的数据。,运行以下命令并确保每个覆盖网络都已加密`docker network ls --filter driver=overlay --quiet | xargs docker network inspect --format '{{.Name}} {{ .Options }}'`,使用 --opt encrypted 标志创建叠加网络。,"https://docs.docker.com/engine/userguide/networking/overlay-security-model/,https://github.com/docker/docker/issues/24253"
7.5,7.5,Docker Swarm 配置,确保在Swarm集群中管理秘密时，使用Docker的秘密管理命令（Not Scored）,请使用Docker内置的秘密管理命令。,在swarm管理器节点上，运行以下命令，并确保在您的环境中使用docker机密管理（如果适用）`docker secret ls`,遵循Docker机密文档并使用它来有效地管理机密。,https://docs.docker.com/engine/reference/commandline/secret/
7.6,7.6,Docker Swarm 配置,确保Swarm管理器以自动锁定模式运行（Scored）,在自动锁定模式下运行 Docker Swarm 管理器。,运行以下命令。如果它输出密钥，则表示swarm已使用--autolock标志初始化。如果输出为未设置解锁密钥，则表明swarm未使用--autolockflag初始化，不符合此建议。 `docker swarm unlock-key` ,如果你正在初始化一个swarm，使用下面的命令：docker swarm init --autolock。如果你想在现有的swarm管理节点上设置--autolock，使用下面的命令：docker swarm update --autolock。,https://docs.docker.com/engine/swarm/swarm_manager_locking/
7.7,7.7,Docker Swarm 配置,确保Swarm Manager自动锁定密钥定期轮换（Not Scored）,定期轮换Swarm管理器自动锁定密钥。,运行以下命令以旋转关键点`docker swarm unlock-key --rotate`。此外，为了便于对该建议进行审计，请维护密钥轮换记录，并确保您为密钥轮换建立预定义的频率。,运行以下命令来旋转密钥。 docker swarm unlock-key --rotate 此外，为了方便审计此建议，请维护密钥旋转记录，并确保建立预定的密钥旋转频率。,https://docs.docker.com/engine/reference/commandline/swarm_unlock-key/
7.8,7.8,Docker Swarm 配置,确保适当地轮换节点证书（Not Scored）,根据需要更换Swarm节点证书。,"运行以下命令，并确保节点证书到期持续时间设置为适当。`docker info | grep ""Expiry Duration""`",执行以下命令以设置所需的到期时间。例如，docker swarm update --cert-expiry 48h。,https://docs.docker.com/engine/reference/commandline/swarm_update/#exampl
7.9,7.9,Docker Swarm 配置,确保适当轮换CA证书（Not Scored）,根据需要旋转根CA证书。,根据您的安装路径，检查根CA证书文件上的时间戳。例如， `ls -l /var/lib/docker/swarm/certificates/swarm-root-ca.crt`，证书应该按照既定的频率轮换。,运行以下命令以旋转证书。 docker swarm ca --rotate,https://docs.docker.com/engine/swarm/how-swarm-mode-works/pki/#rotating-the-ca-certificate
7.1,7.1,Docker Swarm 配置,请确保管理平面流量已经与数据平面流量分离（Not Scored）,将管理平面流量与数据平面流量分开。,在每个swarm节点上运行以下命令，并确保管理平面地址与数据平面地址不同。 `docker node inspect --format '{{ .Status.Addr }}' self` 注意：在编写此基准时，无法检查数据平面地址。已提出一个问题，该问题位于参考链接中。,请用以下方式初始化Swarm：专门为管理和数据平面分别设置接口。例如，docker swarm init --advertise-addr=192.168.0.1 --data-path-addr=17.1.0.3。,"https://docs.docker.com/engine/reference/commandline/swarm_init/#--data-path-addr,https://github.com/moby/moby/issues/33938,https://github.com/moby/moby/pull/32717"
